,id,user_location,text,created_at,username,lang,retweet_count,reply_count,like_count,quote_count
103,1464498208600510466,Canada,The shift in work happening now is MASSIVE. After covid lockdowns people realize they don't want to be underappreciated at a 9 to 5 job so millions of jobs go vacant. Now millions more will resign because of their work's role in the #ClimateCrisis. #TheBigResignation https://t.co/0HYrhhWdJC,2021-11-27 07:35:56+00:00,wendyweb47,en,0,0,0,0
104,1464498126971027464,"Richmond Hill, Ontario, Canada",Big fat Indian weddings in full swing as COVID peters out https://t.co/0k6L0kogQe,2021-11-27 07:35:37+00:00,arvindvijh,en,0,0,0,0
105,1464500148038369287,"BC, Canada","If they put in the Covid protocols they had at the beginning of the pandemic, before the more transmittable variants which kill people easier, the traffic was very scarce, therefore would save on gas &amp; save people's lives, plus the environment; add closed borders &amp; online school https://t.co/JC0t6hl4lZ",2021-11-27 07:43:39+00:00,CoachPerry59,en,0,0,0,0
106,1464502235673550854,"Montreal, Canada","https://t.co/3DCElavV0P

🔥 Covid-19: Omicron declared 'of concern', and Whitty's 'greatest worry'

#OMICRON",2021-11-27 07:51:56+00:00,taypeinternat,en,0,0,0,0
107,1464502209425592327,"Toronto, Ontario",Holy crap. Does anyone read the science anymore? Or do we just take headlines as truth? NACI doesnt even endorse the jabs. Thank you @furey https://t.co/YZjrx8vAAI,2021-11-27 07:51:50+00:00,Konst_kasekas,en,1,0,2,0
108,1464502176810737668,"Hamilton, Canada","New COVID variant threat causes worldwide scramble 
https://t.co/5prytb35mm

Beware the omicron variant.",2021-11-27 07:51:42+00:00,AndrewGeczy,en,0,0,0,0
109,1464504187241304073,"Toronto, Ontario",Half way through this new South Park post covid special. It’s been pretty shit. Cartmans baby saying “please uncle Kyle” was jokes tho,2021-11-27 07:59:42+00:00,meshbets,en,0,0,0,0
110,1464506213165637632,"Québec, Canada 🇨🇦","""New York governor declares a state of emergency in anticipation of new coronavirus surge."" by BY JESSE MCKINLEY via NYT New York Times https://t.co/CrihaDEmG3",2021-11-27 08:07:45+00:00,DJIMB3RRY,en,0,0,0,0
111,1464506201497026565,"Québec, Canada 🇨🇦","""New ‘Variant of Concern’ Fuels Global Fear of Another Virus Surge"" by BY RICHARD PÉREZ-PEÑA AND JASON HOROWITZ via NYT New York Times https://t.co/zNqYWfTCKB",2021-11-27 08:07:42+00:00,DJIMB3RRY,en,0,0,0,0
112,1464506182098468864,"Québec, Canada 🇨🇦","""United States will bar travelers from 8 countries in southern Africa."" by BY ZOLAN KANNO-YOUNGS AND SHERYL GAY STOLBERG via NYT New York Times https://t.co/aOgI5ueMj5",2021-11-27 08:07:37+00:00,DJIMB3RRY,en,0,0,0,0
113,1464510215521386500,"12h-1h, CA","This covid shit isn’t going away anytime soon ..
everyone just needs to do their part.
that’s it",2021-11-27 08:23:39+00:00,chavezz_cris,en,0,0,0,0
114,1464516226441351168,"Hellcity, BC 🇨🇦",why did they name the new covid variant after that transformers villain…,2021-11-27 08:47:32+00:00,jbeanin,en,0,1,0,0
115,1464526309040668674,Canada,"Fuck covid, what is your opinion of th Krogan Genophage?",2021-11-27 09:27:36+00:00,DUBIOUS_MAXIMUM,en,0,0,0,0
116,1464526304561139717,"Victoria, BC","If you're siding with forced lockups, mandatory shots, passports, and other COVID related bigotry, you're so far in the wrong as to defy belief. https://t.co/4yMo6wvOrw",2021-11-27 09:27:35+00:00,koribrus,en,0,0,0,0
117,1464526299251286023,Schutzstaffel Dungeon_CA 94103,"Xi COVID Variant is missing !!! #WHO did that ?
#Omicron jumped the line.

#outsource 690-695 https://t.co/bPt94uilFn",2021-11-27 09:27:33+00:00,VIX38083085,en,0,0,1,0
118,1464534274825064452,"Mission Viejo, CA","NY Gov Kathy Hochul declares state of emergency amid new COVID variant
 https://t.co/O4LhUE6r2O",2021-11-27 09:59:15+00:00,calmtnbiker,en,0,0,0,0
119,1464536358035369992,"US, UK, NL, DE, FR, BE, ES","Opinion: Taking a long hot shower works against Covid. Because of the hot mist which destroys demons in the air and aura, binds them to water and flushes them down the drain. I take at least 3 showers a day and it works. #covid #Corona #vaccines #demons #witches #tips #aura",2021-11-27 10:07:32+00:00,MystrylArt,en,0,0,0,0
120,1464538475047403520,"London UK, & sw N.B. Canada","BBC News - Covid: World races to contain new Omicron variant
https://t.co/zWHfYOaB33",2021-11-27 10:15:56+00:00,melindaelson,en,0,0,0,0
121,1464542513864355842,On hold ,For all my Intl. Student peeps. Are you afraid to go to Aus and get infected with Covid while having classes? And where do you all staying at? How much do you pay for a week rent? I can’t find the right stay for my study period in Australia. It’s all so expensive. 🙁,2021-11-27 10:31:59+00:00,TessInAustralia,en,1,4,2,0
122,1464542495208058887,"Toronto, Ontario",Three shots in #shots shot shots #grateful to be #VAX &amp; have that #Booster 🙏🏽,2021-11-27 10:31:55+00:00,BGabbzz,en,0,0,0,0
123,1464548454181519369,Fish On! ,"World Health Organization skips two letters in Greek alphabet, Nu and Xi  to avoid associating the new COVID-19 variant to Chinese leader Xi Jinping.",2021-11-27 10:55:36+00:00,SandyForLiberty,en,9,7,34,1
124,1464552548656893955,Somewhere on this planet earth,Covid is back to haunt the world once again but this time becoming more dangerous! This shit wouldn't just go away,2021-11-27 11:11:52+00:00,Wessirajput10,en,0,1,0,0
125,1464554531568631817,Canada,The propaganda says the vaccines are highly effective.  The facts say they're incredibly ineffective.  If you stick to the facts most will call you an idiot.  #VaccinesWork just not the Covid ones.,2021-11-27 11:19:45+00:00,canukgord,en,0,0,0,0
126,1464558587599110145,"Montréal, Québec","So, Omicron is supposed to be deadlier and attacking kids especially hard. Is it me or are they just setting up their new  excuses for when kids start dying in masses from vaccine side effects and myocarditis?",2021-11-27 11:35:52+00:00,StephaneFreche2,en,0,2,8,0
127,1464562569730052096,"Kingston, Ontario","If I needed an updated Covid booster every three months to remain safe against latest variants, sign me up.

I would be thankful that we have the science and the society to save lives and make my life and the lives around me better, safer and freer from illness and fear.",2021-11-27 11:51:41+00:00,PeterHRatcliffe,en,10,3,62,0
128,1464562569201467393,NE Hampshire,Home. Had to bite my bottom lip. Two people chatting about still not being vaxed... Then best places around Aldershot to pick Liberty Caps!!🙄 So you won't take the C19 Vax coz your worried about safety🤔. But happy to eat toasted mushrooms my dog &amp; wildlife have pissed on??🤷 https://t.co/IJJ8M6Fkd1,2021-11-27 11:51:41+00:00,Firesnapper999,en,0,1,9,0
